{
  "version": "1.0",
  "updated_at": "2025-11-24",
  "metrics": [
    {"id": "S1-M1", "name": "雷达信号模拟逼真度", "type": "KPP", "target": ">=90%", "unit": "%", "constraints": ["S1-CON1", "S1-CON2"]},
    {"id": "S1-M2", "name": "频段覆盖范围", "type": "KPP", "target": "2-18", "unit": "GHz", "constraints": ["S1-CON1"]},
    {"id": "S1-M3", "name": "雷达散射截面积", "type": "KPP", "target": "<=0.001", "unit": "m²", "constraints": ["S1-CON3"]},
    {"id": "S1-M4", "name": "红外信号特征", "type": "KPP", "target": "<=[低可观测阈值]", "unit": "-", "constraints": ["S1-CON3"]},
    {"id": "S1-M5", "name": "瞬时带宽", "type": "KPP", "target": ">=500", "unit": "MHz", "constraints": ["S1-CON5"]},
    {"id": "S1-M6", "name": "接收机灵敏度", "type": "KPP", "target": "<=-90", "unit": "dBm", "constraints": ["S1-CON5"]},
    {"id": "S1-M7", "name": "时间同步精度", "type": "KPP", "target": "<=10", "unit": "ns", "constraints": ["S1-CON6"]},
    {"id": "S1-M8", "name": "数据链传输速率", "type": "KPP", "target": ">=10", "unit": "Mbps", "constraints": ["S1-CON7"]},
    {"id": "S1-M9", "name": "网络节点容量", "type": "KPP", "target": ">=20", "unit": "个", "constraints": ["S1-CON7"]},
    {"id": "S1-M10", "name": "对1m²目标探测距离", "type": "KPP", "target": ">=200", "unit": "km", "constraints": ["S1-CON8"]},
    {"id": "S1-M11", "name": "对0.001m²目标探测距离", "type": "KPP", "target": ">=40", "unit": "km", "constraints": ["S1-CON8"]},
    {"id": "S1-M12", "name": "跟踪数据率", "type": "KPP", "target": ">=1", "unit": "Hz", "constraints": ["S1-CON8"]},
    {"id": "S1-M13", "name": "雷达散射截面积(平台)", "type": "KPP", "target": "<=0.0001", "unit": "m²", "constraints": ["S1-CON9", "S1-CON12"]},
    {"id": "S1-M14", "name": "接收误码率", "type": "KPP", "target": "<=1E-6", "unit": "-", "constraints": ["S1-CON10"]},
    {"id": "S1-M15", "name": "抗干扰调制类型", "type": "KSA", "target": "FH/DS", "unit": "-", "constraints": ["S1-CON10"]},
    {"id": "S1-M16", "name": "导弹有效射程", "type": "KPP", "target": ">=150", "unit": "km", "constraints": ["S1-CON11"]},
    {"id": "S1-M17", "name": "离轴发射角", "type": "KPP", "target": "±90", "unit": "度", "constraints": ["S1-CON11"]},
    {"id": "S1-M18", "name": "雷达开关机平均故障间隔", "type": "KPP", "target": ">=1000", "unit": "小时", "constraints": ["S1-CON12"]},
    {"id": "S1-M19", "name": "上行/下行数据速率", "type": "KPP", "target": ">=2", "unit": "Mbps", "constraints": ["S1-CON13"]},
    {"id": "S1-M20", "name": "导弹-平台数据链兼容性", "type": "KSA", "target": "Link-16/TDL", "unit": "-", "constraints": ["S1-CON14"]},
    {"id": "S1-M21", "name": "空间分辨率", "type": "KPP", "target": "<=0.3", "unit": "m", "constraints": ["S1-CON15"]},
    {"id": "S1-M22", "name": "抵近侦察安全距离", "type": "KPP", "target": ">=10", "unit": "km", "constraints": ["S1-CON16"]}
  ],
  "constraints": [
    {"id": "S1-CON1", "name": "频谱管理约束", "category": "战术", "description": "需在指定频段时段发射", "priority": "高"},
    {"id": "S1-CON2", "name": "反制规避约束", "category": "环境", "description": "避开敌电子战范围", "priority": "高"},
    {"id": "S1-CON3", "name": "航线安全约束", "category": "环境", "description": "规避敌防空雷达区", "priority": "高"},
    {"id": "S1-CON4", "name": "任务周期约束", "category": "时间", "description": "控制高危区域停留时间", "priority": "中"},
    {"id": "S1-CON5", "name": "阵位几何约束", "category": "几何", "description": "目标侧后向接收位", "priority": "高"},
    {"id": "S1-CON6", "name": "时统可靠性约束", "category": "资源", "description": "需多源时统备份", "priority": "高"},
    {"id": "S1-CON7", "name": "网络联通约束", "category": "协同", "description": "保持视距通信链路", "priority": "高"},
    {"id": "S1-CON8", "name": "跟踪前出约束", "category": "战术", "description": "前出至目标航路侧方", "priority": "高"},
    {"id": "S1-CON9", "name": "辐射管控约束", "category": "战术", "description": "优先保持雷达静默", "priority": "高"},
    {"id": "S1-CON10", "name": "抗干扰约束", "category": "电磁", "description": "复杂电磁环境启用抗干扰模式", "priority": "中"},
    {"id": "S1-CON11", "name": "发射阵位约束", "category": "战术", "description": "需占据有效射程内攻击阵位", "priority": "高"},
    {"id": "S1-CON12", "name": "静默优先约束", "category": "战术", "description": "未被发现时保持静默", "priority": "高"},
    {"id": "S1-CON13", "name": "中继生存约束", "category": "环境", "description": "避免过近接敌", "priority": "中"},
    {"id": "S1-CON14", "name": "平台导弹匹配约束", "category": "协同", "description": "制导平台与导弹型号兼容", "priority": "高"},
    {"id": "S1-CON15", "name": "气象能见度约束", "category": "环境", "description": "恶劣气象影响光学侦察", "priority": "中"},
    {"id": "S1-CON16", "name": "抵近时机约束", "category": "战术", "description": "需在威胁清除后实施", "priority": "高"}
  ]
}
